{
  "project": "端到端测试",
  "date": "2026-05-13",
  "quantity": "2000套",
  "total_quantity": "100000",
  "batch_quantity": "5000",
  "versions": [
    "经济版",
    "高性能版"
  ],
  "selected_version": "高性能版",
  "ai_suggestion": "推荐高性能版：性能更强",
  "risk_tags": [
    {
      "tag": "MCU供货紧张",
      "level": "mid",
      "desc": "交期12-16周"
    }
  ],
  "items": [
    {
      "id": 1,
      "category": "MCU",
      "is_variant": true,
      "func_impact": "主控",
      "exp_impact": "性能",
      "func_impact_label": "关键",
      "exp_impact_label": "重要",
      "user_value": 5,
      "cost_tier": "high",
      "note": "核心器件",
      "variants": [
        {
          "version": "经济版",
          "brand": "Espressif",
          "package": "SMD-18",
          "part_number": "ESP32-C3-MINI-1-N4",
          "description": "160MHz RISC-V, WiFi+BLE5",
          "price_market": 8.5,
          "market_source": "立创商城",
          "market_url": "https://www.szlcsc.com/product/12345",
          "price_ecommerce": 12.0,
          "ecommerce_source": "买手全网",
          "found": true,
          "func_impact_score": 50,
          "exp_impact_score": 50
        },
        {
          "version": "高性能版",
          "brand": "Espressif",
          "package": "SMD-18",
          "part_number": "ESP32-S3-WROOM-1-N8R8",
          "description": "240MHz 双核, WiFi+BLE5, 8MB PSRAM",
          "price_market": 15.9,
          "market_source": "华秋商城",
          "market_url": "https://www.hqchip.com/product/67890",
          "price_ecommerce": 20.0,
          "ecommerce_source": "买手全网",
          "found": true,
          "func_impact_score": 80,
          "exp_impact_score": 80
        }
      ]
    },
    {
      "id": 2,
      "category": "电源",
      "is_variant": false,
      "brand": "AMS",
      "package": "SOT-223",
      "part_number": "AMS1117-3.3",
      "description": "LDO 3.3V 1A",
      "price_market": 0.85,
      "market_source": "博查搜索",
      "market_url": "https://some-search-engine.com/result",
      "price_ecommerce": 1.2,
      "ecommerce_source": "买手全网",
      "found": true,
      "cost_tier": "low",
      "func_impact": "电源稳定",
      "exp_impact": "影响可靠性",
      "func_impact_label": "一般",
      "exp_impact_label": "一般",
      "user_value": 3,
      "note": "博查搜到的价格，来源不是确认商城"
    },
    {
      "id": 3,
      "category": "阻容感",
      "is_variant": false,
      "brand": "YAGEO",
      "package": "0603",
      "part_number": "100nF 0603",
      "description": "MLCC, 50V, 10%",
      "price_market": null,
      "market_source": "",
      "market_url": "",
      "price_ecommerce": null,
      "ecommerce_source": "",
      "found": false,
      "cost_tier": "low",
      "func_impact": "去耦",
      "exp_impact": "稳定性",
      "func_impact_label": "一般",
      "exp_impact_label": "一般",
      "user_value": 2,
      "note": "经验估算",
      "price_estimated_experience": 0.03
    },
    {
      "id": 4,
      "category": "结构件",
      "is_variant": false,
      "brand": "-",
      "package": "-",
      "part_number": "USB-C 插座 16P",
      "description": "沉板 USB-C 16Pin 5A",
      "price_market": null,
      "market_source": "",
      "market_url": "",
      "price_ecommerce": 2.5,
      "ecommerce_source": "买手全网",
      "found": true,
      "cost_tier": "low",
      "func_impact": "充电",
      "exp_impact": "用户体验",
      "func_impact_label": "一般",
      "exp_impact_label": "一般",
      "user_value": 3,
      "note": "商城无结果，仅买手搜到"
    }
  ]
}