{
  "project": "智能桌面控制台",
  "date": "2026-05-13",
  "quantity": "2000套",
  "total_quantity": "100000",
  "batch_quantity": "5000",
  "versions": [
    "经济版",
    "标准版",
    "高性能版"
  ],
  "selected_version": "高性能版",
  "ai_suggestion": "推荐高性能版：ESP32-S3-WROOM-1-N16R8 性能更强，带 8MB PSRAM，适合后续功能扩展",
  "risk_tags": [
    {
      "tag": "ESP32-S3 供货紧张",
      "level": "mid",
      "desc": "乐鑫芯片交期 12-16 周，建议提前备货"
    },
    {
      "tag": "显示屏模组定制",
      "level": "high",
      "desc": "3.5寸触摸屏需确认 FPC 引脚定义"
    }
  ],
  "items": [
    {
      "id": 1,
      "category": "MCU",
      "is_variant": true,
      "func_impact": "主控性能直接影响 UI 流畅度和 WiFi/BLE 连接稳定性",
      "exp_impact": "高性能 MCU 带来更流畅的触控响应和更快的无线连接",
      "func_impact_label": "关键",
      "exp_impact_label": "重要",
      "user_value": 5,
      "cost_tier": "high",
      "note": "三版本 MCU 性能差异较大，影响整体体验",
      "variants": [
        {
          "version": "经济版",
          "brand": "Espressif",
          "package": "SMD-18",
          "part_number": "ESP32-C3-MINI-1-N4",
          "description": "160MHz RISC-V, WiFi+BLE5, 4MB Flash",
          "price_market": 8.5,
          "market_source": "立创商城",
          "market_url": "https://www.szlcsc.com/search.html?keyword=ESP32-C3-MINI-1-N4",
          "price_ecommerce": 12,
          "ecommerce_source": "买手全网",
          "found": true,
          "func_impact_score": 50,
          "exp_impact_score": 50
        },
        {
          "version": "标准版",
          "brand": "Espressif",
          "package": "SMD-18",
          "part_number": "ESP32-S3-WROOM-1-N8R8",
          "description": "240MHz 双核, WiFi+BLE5, 8MB PSRAM",
          "price_market": 15.9,
          "market_source": "立创商城",
          "market_url": "",
          "price_ecommerce": 20,
          "ecommerce_source": "买手全网",
          "found": true,
          "func_impact_score": 80,
          "exp_impact_score": 80
        }
      ]
    },
    {
      "id": 7,
      "category": "接口",
      "is_variant": false,
      "brand": "-",
      "package": "SMD",
      "part_number": "USB-C 插座 16P",
      "description": "沉板 USB-C 插座, 16Pin, 支持 5A 大电流",
      "price_market": 1.5,
      "market_source": "经验估算",
      "market_url": "",
      "price_ecommerce": 2.5,
      "ecommerce_source": "买手全网",
      "found": false,
      "cost_tier": "low",
      "func_impact": "USB-C 插座影响充电和数据传输稳定性",
      "exp_impact": "插座手感和可靠性影响日常使用体验",
      "func_impact_label": "一般",
      "exp_impact_label": "一般",
      "user_value": 3,
      "note": "经验估算，建议实际询价",
      "price_estimated_experience": 1.27
    }
  ]
}